Ansel Biotech,https://www.anselbiotech.in/,Vadodara,Specialty enzymes,"Industrial enzymes for distillery, detergent, food, wastewater treatment",< ₹50 Cr,Renish Patel,CEO,Commerce graduate and a qualified Chartered Financial Analyst with a professional background as an equity research analyst and associate,Strong,Dedicated enzyme production facility in Vadodara.,Strong,HQ Vadodara,Moderate,Customized industrial enzyme solutions for niche applications like wastewater & distillery.,Moderate,Renish Patel is a commerce graduate and a qualified Chartered Financial Analyst with a professional background as an equity research analyst and associate,Strong,Enzyme applications in sustainability & industrial processing.,Moderate,Active operations with focus on emerging enzyme segments.,67.5,B — Probable Federer,Decent enzyme play but moderate differentiation and growth signals.,"Specializing in niche industrial enzymes for distillery, wastewater treatment and food processing applications."
Angel Chemicals Private Limited,https://www.angelchemical.com/,Vadodara,Water treatment chemicals / industrial chem.,"Manufacture a wide range of water treatment chemicals, polyelectrolytes, industrial chemicals, and testing kits",₹5 - ₹25 Cr,Mr. Nitin Patel,"CEO, Director","no technical background information is publicly available for Mr. Nitin Patel, Zauba Corp — only list him as Director, no educational qualifications",Strong,"Primarily a  manufacturer, also a trader, distributor, and service provider",Strong,HQ in Vadodara,Strong,"Combining the production of industry-standard basic chemicals with an experienced R&D department, customized packaging, and specialized maintenance services",Fail,"no technical background information is publicly available for Mr. Nitin Patel, Zauba Corp — only list him as Director, no educational qualifications",Strong,"Active Indian manufacturer of basic chemicals (NIC Code 241) that aligns with national manufacturing initiatives, possesses an Import Export Code for global trade",Fail,"no active hiring, no facility expansion, no datable certification, no updated website, and MCA filings are stale since 2022",60,B — Probable Federer,Strong manufacturing presence but weak technical DM and zero recent growth signals.,Combines manufacturing with customized R&D solutions for water treatment chemicals and polyelectrolytes.
Diamines And Chemicals,https://dacl.co.in/contact-us/,Vadodara,Specialty chemicals,"Ethylenediamine, diethylenetriamine, piperazine anhydrous, monoethanol amine, triethylenediamine, polyamine mix sweetening",₹12.25 Cr,Mr. Amit M. Mehta,Executive Chairman,"Mr. Amit Mehta is Executive Chairman with long industry tenure but no publicly documented PhD, IIT/IISc, or scientific publication record",Strong,Sole Indian manufacturer of ethyleneamines using fully indigenous proprietary technology developed in-house since 1982,Strong,HQ in Vadodara,Strong,"DSIR-recognized R&D centre, proprietary manufacturing technology placing DACL among select 6–8 global companies producing ethyleneamines",Moderate,"Mr. Amit Mehta is Executive Chairman with long industry tenure but no publicly documented PhD, IIT/IISc, or scientific publication record",Moderate,"Ethyleneamines serve pharma, agrochem, and gas sweetening — stable end-markets with no direct PLI eligibility or specific export policy push ",Fail,"Hiring: no open roles found on Naukri or LinkedIn; Facility: no new plant announced in 18 months; Certifications: ISO 9001, 14001, 45001 present but no new approval dated in last 2 years",60,B — Probable Federer,Sole manufacturer with DSIR advantage but weak growth signals and moderate technical DM.,Sole Indian manufacturer of ethyleneamines using fully indigenous proprietary technology since 1982.
FAIRMATE CHEMICALS PVT LTD,https://fairmatebd.com/,Vadodara,Construction chemicals,"400+ construction chemical products including concrete admixtures, waterproofing systems, engineering grouts, industrial flooring, surface treatment, concrete repairs",₹1 Cr-₹10 Cr,Mr. Bhavesh Baldevbhai Shah,Director,Joint Managing Director with 27 years of experience and expertise in general business and technology,Strong,Multi-location manufacturing plants across 7 Indian cities and 4 international locations — clear manufacturing footprint,Strong,Manufacturing unit in Vadodara,Moderate,"Technical collaboration with Resin Building Products UK and Morton Chemicals USA; ISO 9001, EMS 14001 and OHSAS 18001 certified; 350+ products developed— no patents found",Fail,family-owned with no documented engineering or science qualifications publicly,Strong,"Construction chemicals directly benefit from India's infrastructure push, PM Gati Shakti, smart cities program, and affordable housing — strong government spending tailwind",Moderate,"Website active with 2026 copyright and Bangladesh entity actively updated; no public hiring data, no expansion announced, no fresh certifications dated, no MCA revenue filings visible — 1 signal met (active website)",57.5,C — Borderline,Good manufacturing footprint and sector tailwind but weak technical DM and limited growth signals.,Expanded manufacturing footprint across 7 Indian cities with international presence in construction chemicals.
Scientific Research Instruments Company Pvt Ltd,https://srico-labworld.com/,Vadodara,Scientific and Laboratory Equipment,"Product and application consultation, system integration, equipment installation. Does NOT manufacture products",₹10 Cr - ₹100 Cr,Shalini Rao,Director,Has no publicly available technical or scientific background indicating domain expertise.,Fail,"Distributor and service provider that aims to ""bridge the gap"" between international manufacturers and customers, it doesn't manufacture any product of its own.",Strong,"HQ in BLR, operates/manufactures in Vadodara",Strong,"25+ years industry leadership, global manufacturer partnerships, and ""One Team"" technical lifecycle support from consultation to IQ/OQ documentation",Fail,"Decision maker (Shalini Rao, Director) has no publicly available technical or scientific background indicating domain expertise.",Moderate,"Growing sector demand but no direct access to PLI, Make-in-India, China+1, or export benefits as a foreign brand distributor.",Moderate,website remains current with a 2025 copyright and an active news section documenting its participation in 2026 industry exhibitions like the India Pharma Expo and ChemProTech Expo,50,C — Borderline,Fails on manufacturing as it is a distributor/service provider and weak technical DM.,Actively participating in major 2026 industry exhibitions like India Pharma Expo and ChemProTech Expo.
Vitarag Chemicals,https://www.vitarag.in/,Vadodara,Metal pre-treatment chemicals,"Degreasing chemicals,rust removers,phosphating chemicals,paint removers, passivation chemicals, and 3-in-1 metal treatment chem.",₹5 - 25 Cr,Mr. Hardik Parekh,Proprietor,Decision maker is a proprietor with no publicly available technical or scientific background.,Strong,"Owns its own brand ""Vitarag Chemical,"" runs its own production infrastructure with modern machinery, and conducts in-house quality testing at every stage of production.",Strong,HQ in Vadodara,Moderate,"Some technical depth (salt spray certified, own brand, ISO 9001:2015) but no patents, DSIR recognition, or USFDA/EU-GMP approvals.",Fail,Decision maker is a proprietor with no publicly available technical or scientific background.,Moderate,"Metal pre-treatment chemicals serve a stable, essential industrial niche tied to India's growing auto sector, but the segment has no direct PLI eligibility, no specific export tailwinds, and no Make-in-India policy push targeted at this sub-category.",Moderate,"meets only 1 growth signal — an actively updated website with May 2026 posts — but shows no hiring, no facility expansion, no datable new certification, and no financial filings.",47.5,C — Borderline,Basic manufacturing but weak technical DM and only moderate differentiation.,Runs its own modern production facility with in-house quality testing for metal pre-treatment chemicals.
CHLORITECH INDUSTRIES,https://www.chloritech.com/,Vadodara,Specialty chemicals — chlorine-based chemistry,"Chloral anhydrous, chloral hydrate, ethyl chloride, trichloroacetic acid, hexachloroacetone, ethyl trichloroacetate, specialist in bulk chlorination using glass-lined vessels",No public filing found,Mr. Bhavik Shah,Founder,Family-owned with in-house technical scale-up capability across 47 years — but no named PhD or IIT-qualified founder found,Strong,Manufactures chlorine-based specialty chemicals in-house using glass-lined vessels with own ISO tank fleet for hazardous transport,Strong,Vadodara-based,Moderate,Specializes in niche chlorinated products with in-house scale-up from lab to bulk; ISO 9001 certified — no patents or DSIR recognition found,Moderate,Family-owned with in-house technical scale-up capability across 47 years — but no named PhD or IIT-qualified founder found,Moderate,"Chlorinated specialty chemicals serve pharma and agrochem intermediates — stable demand, China+1 partial beneficiary but no direct PLI eligibility",Fail,"No hiring found, no expansion announced, website copyright 2019, no financial filings visible — zero signals",47.5,C — Borderline,Niche manufacturing but stagnant growth signals and moderate technical depth.,Specializes in bulk chlorination chemistry using glass-lined vessels for high-purity chlorinated intermediates.
