Company Name,Website,City,Segment,What They Make,Revenue Band,Decision Maker,DM Title,DM Background,C1 Manufacturer Score,C1 Evidence,C2 India Score,C2 Evidence,C3 Differentiation Score,C3 Evidence,C4 Tech DM Score,C4 Evidence,C5 Tailwind Score,C5 Evidence,C6 Growth Score,C6 Evidence,Federer Score,Score Band,Reasoning,Personalization Hook
Gujarat Fluorochemicals,https://gfl.co.in/,Vadodara,Specialty chemicals,"PTFE, PFA, FEP, FKM, PVDF fluoropolymers; fluorospeciality chemicals (EDFA, TEOF, BTFM); refrigerants (R22, R32, R410A); ","₹4,852 Cr",Mr. Vivek Kumar Jain,Managing Director,Vivek Jain is an IIM-A alumnus with 30 years' experience leading GFL in advanced materials manufacturing and green energy R&D,Strong,"Pure manufacturer — completely backward-integrated operations from natural minerals to finished fluoropolymers, with three manufacturing facilities in India.",Strong,"HQ (Noida), manufacturing operation in Gujarat",Strong,"Company holds multiple patents in fluoropolymers and lithium-based specialty chemical processes, backed by dedicated R&D centres, global regulatory certifications, and captive raw material integration, indicating strong technical differentiation and proprietary process capability.",Strong,"Vivek Jain, the Managing Director & Non Independent Director, is an IIM-A alumnus with 30 years' experience leading GFL in advanced materials manufacturing and green energy R&D",Strong,"PLI-linked (EV battery supply chain), China+1 beneficiary, export markets in EU & US",Strong,"multi-standard certifications, a current investor-facing website, and publicly reported revenue of ₹4,852 Cr. To modernize the business, the company implemented a specialized ""three-in-one"" crystallizer that integrates crystallization, filtration, and drying into a single device for improved safety and efficiency",100,A — Strong Federer,"Backward-integrated fluoropolymer giant with deep R&D, strong IP moat, technical leadership and powerful PLI+China+1 tailwinds.",One of the very few integrated Indian companies building India’s first fully integrated battery materials plant with IFC backing.
Deepak Nitrite,https://www.godeepak.com/,Vadodara,Specialty & basic chemicals,"Sodium nitrite, sodium nitrate, nitro toluene, fuel additives, xylidines, cumidines, colour intermediates, phenol, acetone, IPA","₹7,946 Cr ",Maulik Mehta,CEO,"Maulik Mehta holds a Bachelor of Business Administration and a Master’s in Industrial and Organisational Psychology, supplemented by executive education from Harvard Business School",Strong,"Pure manufacturer — manufacturing facilities at Nandesari, Dahej (Gujarat), Taloja, Roha (Maharashtra), and Hyderabad (Telangana)",Strong,HQ in Vadodara,Strong,"Company holds multiple process patents in specialty chemicals and industrial systems, backed by Responsible Care recognition, global-quality compliance, and a 100% Together for Sustainability audit score at its Dahej plant, indicating strong technical and operational differentiation.",Strong,Deepak C. Mehta has 50+ years in chemical intermediates and chairs National Chemicals Committee at FICCI; CEO Maulik Mehta holds MBA-Harvard and Masters-Columbia.,Strong,"Signed ₹5,000 Cr MoU with Govt. of Gujarat; expanding into specialty fluorochemicals and polycarbonates — all PLI-adjacent, Make-in-India aligned.",Strong,"Hiring actively recruiting at Nandesari & Bharuch; Facility acquiring Trinseo's polycarbonate assets in Germany for ₹5,000 Cr. Modernizes through safer venturi-based synthesis, high-purity product engineering, and 80% wastewater resource recovery",100,A — Strong Federer,"Large-scale pure manufacturer with excellent technical pedigree, massive expansion and strong specialty chemicals momentum.",One of the leading Indian companies rapidly expanding in nitration chemistry with strong China+1 momentum.
AARTI INDUSTRIES,https://www.aarti-industries.com/,Vadodara,Specialty chemicals,"100+ products across specialty chemicals, CDMOs, agrochemicals, pharma APIs, polymers, pigments, dyes, battery materials, and electronic chemicals","₹8,042 Cr",Mr. Rajendra V. Gogri,CMD,"Holds master's in Chemical Engineering from USA and is a rank holder from UDCT Mumbai, a technical expert in establishing chemical value chains and driving digital transformation",Strong,16 manufacturing plants; fully integrated from benzene/toluene feedstocks to specialty chemicals across 100+ products,Strong,HQ Mumbai with manufacturing in Vadodara,Strong,"Company holds patented specialty chemical process innovations and is globally ranked first in dichlorobenzene, backed by leadership in nitro chloro benzene chemistry and strong sustainability recognitions including Responsible Care, EcoVadis Gold, CDP “A” rating, and Together for Sustainability certification.",Strong,CMD Rajendra Gogri holds Masters in Chemical Engineering from USA and rank from UDCT; Vice CMD Renil Gogri is B.Tech IIT Mumbai; Chief Scientific Officer Dr. Prashant Potnis is a PhD,Strong,"Directly invested ₹3,000 Cr in China+1 tailwinds; PLI-adjacent specialty chemicals; exports to 60+ countries in US, EU, and Japan",Strong,"Hiring: continuously recruiting across 16 plants; Facility: new Jhagadia unit commissioned, Dahej ethylation facility added; Certifications: EcoVadis Gold, CDP A rated in 2025; Website: copyright 2026. The company is modernizing its business by implementing a next-gen cloud-based ERP, IIoT-driven real-time manufacturing insights, and AI-powered automation across its core operations",100,A — Strong Federer,Highly integrated specialty chemicals player with top technical leadership and strong global+PLI tailwinds.,One of the top global players in dichlorobenzene and recently secured a USD 150 Million multi-year supply contract with a global agrochemical major.
Allchem Lifescience Ltd.,https://www.allchemlifescience.com/,Vadodara,Specialty chemicals & pharma intermediates,"API intermediates, key starting materials (KSMs), specialty/fine chemicals",₹150-160 Cr,Bipin Kantilal Patel,Chairman & MD,"Bipin Kantilal Patel holds an M.Sc. in Organic Chemistry and has over 28 years of expertise in pharmaceutical R&D, product development, and process manufacturing",Strong,"Owns and operates dedicated manufacturing plant at Manjusar, Vadodara with capacity expansions (from 173 KL to 511 KL) for bulk drug intermediates.",Strong,HQ Vadodara,Strong,"Custom synthesis specialist with focus on high-value intermediates for innovator molecules, regulatory compliance & R&D (200+ molecules).",Strong,"Bipin Kantilal Patel holds an M.Sc. in Organic Chemistry and has over 28 years of expertise in pharmaceutical R&D, product development, and process manufacturing",Strong,PLI scheme benefits for pharma intermediates + strong exports to regulated markets (US/Europe/Japan).,Strong,"Consistent revenue growth (₹151.5 Cr in FY25), capacity expansions & ongoing solar power project. Modernizing through advanced research facilities, global regulatory compliance, and sustainable manufacturing practices",100,A — Strong Federer,"Strong custom synthesis focus, full technical MD with robust manufacturing and regulatory strength.",Successfully expanded manufacturing capacity from 173 KL to 511 KL at its Manjusar facility for high-value pharma intermediates.
Infinita Biotech Pvt. Ltd.,https://infinitabiotech.com/,Vadodara,Specialty biotech enzymes,"Detergent, food, feed, textile, distillery, industrial enzymes & blends",₹50-100 Cr,Adarsh Desai,Founder & MD,Technical & entrepreneurial background (NMIMS education).,Strong,"Runs dedicated enzyme manufacturing plant at Krishna Industrial Estate, Vadodara with in-house production & formulation.",Strong,HQ Vadodara,Strong,"DSIR-recognized R&D, 200+ custom products, exports to 55+ countries with focus on application-specific enzymes.",Strong,Founder has strong R&D & technical pedigree driving innovation.,Strong,"Strong demand in sustainable biotech enzymes for food, feed & industrial applications.",Strong,"Rapid export expansion, awards to MD, active news/press & DSIR recognition. To modernize the business, the company is expanding its DSIR-recognized R&D capabilities, establishing a pilot plant for specialized enzyme production, and developing innovative solutions for second-generation biofuels",100,A — Strong Federer,"Excellent biotech enzyme specialist with DSIR recognition, strong exports, technical founder and clear growth signals.",DSIR-recognized company exporting custom enzymes to 55+ countries with strong application-specific R&D capabilities.
Apicore Pharmaceuticals Pvt. Ltd.,http://apicore.com/,Vadodara,Complex APIs,"Specialty & complex APIs (oncology, injectables, niche molecules)",Mid-size,Dr. Ravishanker Kovi,President & CSO,Possesses a technical background including a PhD in Organic Chemistry and extensive experience in pharmaceutical research and development,Strong,"USFDA-approved dedicated API manufacturing plant at Padra, Vadodara region.",Strong,Vadodara area (India operations),Strong,"company holds multiple patents for advanced pharmaceutical manufacturing processes and specializes in difficult-to-synthesize, high-value APIs, supported by strong USFDA compliance, regulated-market focus, and a well-established R&D and process-development pipeline.",Strong, CSO possesses a technical background including a PhD in Organic Chemistry and extensive experience in pharmaceutical research and development,Strong,Regulated complex APIs with strong export tailwinds to US/EU markets.,Strong,"Multiple regulatory approvals, capacity additions & consistent compliance track record. The company develops economical, eco-friendly, and commercially scalable manufacturing methods to modernize production and enhance drug purity",100,A — Strong Federer,USFDA-approved complex API manufacturer with PhD-level technical leadership and strong regulated market positioning.,USFDA-approved manufacturer specializing in complex and difficult-to-synthesize APIs from its Padra facility.
Tatva Chintan Pharma Chem Ltd.,https://www.tatvachintan.com/,Vadodara,Specialty chemicals,"Phase transfer catalysts (PTCs), structure directing agents (SDAs), pharma/agro intermediates",₹350-450 Cr,Chintan Nitinkumar Shah,Chairman & MD,Chintan Nitinkumar Shah is a computer engineer who earned his Bachelor of Engineering from the Maharaja Sayajirao University of Baroda,Strong,"Multiple dedicated manufacturing plants (Dahej, Ankleshwar) with Vadodara R&D.",Strong,HQ Vadodara,Strong,"Leader in specialty catalysts with patents, R&D focus & high export orientation.",Strong,Technical promoter with engineering background heading R&D.,Strong,Specialty chemicals exports & innovation tailwinds.,Strong,"Public company with consistent filings, capacity additions & global market growth. The company modernizes by the adoption of new-age technologies, and a focus on sustainable ""green"" chemistry",100,A — Strong Federer,"Specialty catalysts leader with patents, strong R&D, public company growth and technical promoter.",Leading Indian producer of phase transfer catalysts and structure directing agents with strong patent portfolio and exports.
Zydex Industries,https://zydexgroup.com/,Vadodara,Specialty chemicals,"Globally patented nanotechnology-based road additives, waterproofing compounds, water-based specialty polymers for textiles",₹384 Cr,Mr. Ajay Ranka,CEO & MD,Dr. Ajay Ranka is a distinguished chemical engineer with a Ph.D. in Polymer Science and Engineering from Lehigh University who began his professional career at PPG Industries,Strong,"owns manufacturing infrastructure, in-house R&D labs, and state-of-the-art production facilities across India",Strong,HQ in Vadodara,Strong,"Company holds multiple global patents in nanotechnology-based organosilicon compounds and polymeric microgels for waterproofing, asphalt adhesion, and bio-fertilization applications, with large-scale institutional adoption across more than 40 countries, indicating strong proprietary innovation and technical differentiation.",Strong,Dr. Ajay Ranka is a distinguished chemical engineer with a Ph.D. in Polymer Science and Engineering from Lehigh University who began his professional career at PPG Industries,Strong,"Operates across roads, textiles, agriculture, and construction — all aligned with India's infrastructure push, Make-in-India, and organic farming policy tailwinds",Strong,"Hiring 16 active jobs on Naukri April 2026 Press Information Bureau; Financial ₹384 Cr revenue with 30% CAGR filed with MCA PRSIndia; Website copyright 2024, active LinkedIn. Zydex modernizes traditional industries by deploying sustainable nanotechnology-based solutions for textiles and construction alongside chemical-free bio-farming protocols and ESG standards.",100,A — Strong Federer,Patented nanotechnology products with global adoption and strong innovation plus infrastructure tailwinds.,"Pioneer in globally patented nanotechnology-based additives for roads, waterproofing and construction chemicals."
Chemcon Speciality Chemicals Ltd ,https://www.cscpl.co.in/,Vadodara,"Pharmaceutical Manufacturing, speciality chem.","Manufacture pharmaceutical intermediates, silicones, and oilfield chemicals, including completion fluids and clear brines",₹100 - ₹500 Cr,Kamal Kumar Aggarwal,Chairman & MD,Holds a Diploma in Petrochemical Technology and has more than twenty-three years of specialized experience in the chemical industry,Strong,"Operates its own manufacturing plant in Manjusar and is formally classified as a ""Manufacturer"" in its corporate profile",Strong,HQ in Vadodara,Strong,Market leader in Hexamethyldisilazane and operates a zero effluent discharge facility that recycles treated waste water for its processes,Moderate,"Has strong process engineering and R&D experience, though no top-tier academic credentials are publicly documented.",Strong,"Strong presence in global pharma supply, exports, and specialty chemicals, aligned with China+1 strategy and pharma sector growth.",Strong,"Demonstrates clear growth signals through capacity expansions, consistent exaport business to regulated global markets, and sustained demand from pharma and oilfield sectors. Modernizing its business through technology upgradations, process re-engineering to minimize waste, and the implementation of sustainable infrastructure such as zero-liquid discharge and solar power.",90,A — Strong Federer,Strong manufacturing and export performance in pharma intermediates with solid technical depth.,Market leader in HMDS (Hexamethyldisilazane) operating a zero effluent discharge facility for specialty silanes.
AMI LIFESCIENCES PVT. LTD.,https://amilifesciences.com/index.php,Vadodara,Pharmaceutical — pure-play API,"Generic APIs and intermediates across cardiovascular, anti-diabetics, CNS, and respiratory therapeutic categories; also offers contract development and manufacturing",₹660 Cr,Mr. Girish Chovatia,Chairman & MD,Holds an MBA and possesses over two decades of experience in pharmaceutical and specialty chemical marketing and management,Strong,"Pure-play API manufacturer with backward-integrated supply chain and CMO/CDMO capabilities — explicitly states ""no conflict of interest with customers""",Strong,HQ in Vadodara,Strong,"Company holds multiple pharmaceutical process patents for high-purity API manufacturing and has 15+ global regulatory approvals including EU-GMP, WHO-GMP, PMDA Japan, and DSIR recognition, reflecting strong technical differentiation and advanced large-scale manufacturing capability.",Moderate,"20+ years of pharma industry experience but no PhD, IIT/IISc, or published research on record; R&D is headed separately by Virendra Thakrar",Strong,"API manufacturing is PLI-eligible (Bulk Drugs PLI scheme), directly benefits from China+1 sourcing shift, Make-in-India aligned, and has active government push — sector tailwinds are among the strongest in Indian pharma",Strong,"Hiring: walk-in interview held on 2nd May 2026 for production roles at Karakhadi facility Facility: ₹80 Cr capex underway in FY26 for capacity expansion and 10 MW solar installation. Modernizing its operations by implementing automation, continuous manufacturing, and green chemistry while transitioning to renewable solar energy and expanding into biotechnology",90,A — Strong Federer,Solid API manufacturer with multiple global regulatory approvals and active capacity expansion.,Recently announced ₹80 Cr capex for capacity expansion and solar power installation at its Karakhadi facility.
Sun Pharma Advanced Research Company Ltd. ,https://sunpharma.com/,Vadodara,Pharmaceutical Manufacturer,"Manufactures specialty generics, innovative medicines, consumer healthcare products, and active pharmaceutical ingredients (APIs)",₹71.77 Cr,Dilip S. Shanghvi,Chairman,Holds a Bachelor of Commerce from the University of Calcutta and gained practical expertise managing his father's pharmaceutical trading business,Strong,Operates 41 global plants with a vertically integrated in-house R&D-to-production pipeline,Strong,"Global HQ is in Mumbai, Regd Office in Vadodara",Strong,Company holds multiple patents in innovative drug delivery and controlled-release technologies and is a leading global pharmaceutical player with strong R&D-driven differentiation and large-scale presence in India and the US generics market.,Moderate,"Despite a commerce background, built a global pharma company through practical industry insight and by targeting high-margin, underserved segments. Dilip Shanghvi’s children, Aalok and Vidhi, already work for Sun Pharmaceuticals",Strong,"15.1% YoY revenue increase, the 2025 merger of five subsidiaries, recent USFDA product approvals, and active manufacturing capacity expansions at its Mohali and Paonta Sahib facilities",Strong,"15.1% YoY revenue increase in Q3FY26, the 2025 merger of five subsidiaries, recent USFDA product approvals, and active manufacturing capacity expansions. Modernizing its business by consolidating R&D facilities, optimizing operational costs, and evaluating AI to accelerate drug development",90,A — Strong Federer,"Large-scale operations with strong financial growth, slightly diluted by commerce background of founder.",Reported strong 15.1% YoY revenue growth along with multiple USFDA approvals and facility expansions.
Century Pharmaceuticals Ltd.,https://www.centurypharma.com/,Vadodara,APIs & pharma intermediates,Active pharmaceutical ingredients & related products,₹100-300 Cr,Janak Sheth,Managing Director,Janak Sheth is an IIT Delhi Chemical Engineering graduate with an honorary PhD and over 45 years of technical experience in pharmaceutical manufacturing and equipment design,Strong,Own manufacturing facility in Vadodara producing APIs.,Strong,HQ Vadodara,Strong,"Biotechnology pioneer and DSIR-recognized innovator that develops patented and proprietary targeted therapies, such as its unique asthma molecule and first-in-India New Biological Entity (NBE) candidates, while operating a US FDA-approvable and WHO-GMP certified manufacturing facility",Strong,Janak Sheth is an IIT Delhi Chemical Engineering graduate with an honorary PhD and over 45 years of technical experience in pharmaceutical manufacturing and equipment design,Strong,Pharma APIs under PLI & Make-in-India support.,Moderate,Stable operations with regulatory compliance track record. The company modernizes its business by utilizing a state-of-the-art manufacturing facility and investing in API research and biotechnology,90,A — Strong Federer,IIT Delhi Chemical Engineer MD gives strong technical score but only moderate growth signals.,Led by an IIT Delhi Chemical Engineer as Managing Director with strong focus on API manufacturing.
Antozyme Biotech Pvt. Ltd.,https://antozyme.com/,Vadodara,Specialty biotech enzymes,"Industrial, food, pharma, distillery, detergent enzymes, probiotics blends & custom formulations",₹10-25 Cr,Rinkeshkumar Thakorbhai Patel,Managing Director,"Technical education from ARIBAS, hands-on biotech & enzyme manufacturing background.",Strong,"Operates dedicated fermentation & formulation plant at Shed No. 303/19, Makarpura GIDC, Vadodara producing enzymes in-house (confirmed via MCA & company sources).",Strong,HQ Vadodara,Moderate,Focuses on custom enzyme development & manufacturing with exports to 34+ countries and in-house R&D capabilities.,Strong,MD has direct biotech technical education and domain expertise.,Strong,"Benefits from strong tailwinds in industrial biotech, enzymes for sustainability, food processing & exports.",Strong,"Revenue growth shown in filings, export market expansion & active website with regular updates.",87.5,A — Strong Federer,Good technical founder with strong biotech enzyme growth story and solid export performance.,Strongly growing custom enzyme manufacturer with exports to over 34 countries from its Vadodara plant.
Kalintis Healthcare Pvt Ltd,https://kalintis.com/html/index.html,Vadodara,Active Pharmaceutical Ingredients (APIs),"Manifacture Active Pharmaceutical Ingredients (APIs), specialized pharmaceutical intermediates, complex molecules",<₹50 Cr,Rasik Gondalia,Chairman,B.Sc. Pharmacy graduate and patent-holding industry veteran with 26 years of expertise in pharmaceutical manufacturing and quality assurance,Strong,"Pharmaceutical manufacturing and R&D service provider, rather than a trading or distribution-only firm",Strong,HQ in Vadodara,Strong,"Operates a state-of-the-art facility that complies with USFDA 21 CFR norms and has already secured ""Approved"" status for multiple US Drug Master Files (DMFs) for drug substances like Furosemide and Lorazepam",Moderate,"Holds a B.Pharm degree with strong pharmaceutical industry experience, but lacks advanced research credentials.",Strong,"As an Indian-based manufacturer with a USFDA-compliant facility, it is strategically positioned for global trade by actively supplying APIs and intermediates to the US, EU, and international markets",Fail,"Stale 2019 website, no active hiring, declining revenue (-21% CAGR), shrinking headcount (-20% YoY), and no confirmed new certifications or facility expansion. Though the company is modernizing by investing in a state-of-the-art R&D center, a Technology Development Center, and expanded API manufacturing facilities",70,B — Probable Federer,USFDA-compliant API maker with B.Pharm leadership but weak recent growth signals.,Secured multiple USDMFs for key APIs including Furosemide and Lorazepam from its USFDA-compliant facility.
Aries Chemtech,https://arieschemical.com/,Vadodara,Industrial water treatment and specialty chem.,"Manufacture chemicals for boilers, cooling towers, RO plants, and sugar processing, as well as polymers and phosphonates",No direct financial data available,Rajesh Mehta,Plant Head,Not identified,Strong,Manufacturer that operates a dedicated Chemical Manufacturing Unit for both batch-wise and bulk production,Strong,HQ in Vadodara,Strong,"GMP Certified and utilize an in-house R&D facility and Pilot Testing to develop proprietary, customized formulations",Fail,Not identified,Moderate,They align with Make-in-India relevance by providing essential manufactured solutions to over 40 different industrial sectors,Strong,"actively growing with 2 signals — a current 2026 website and a newly obtained GMP certification — despite no visible hiring, facility expansion, or financial filings.",70,B — Probable Federer,Strong manufacturing and GMP but lacks clear technical DM qualification and limited growth signals.,GMP-certified manufacturer with in-house R&D developing customized formulations for water treatment chemicals.
Annexe Chem / Annelx Chem,https://annexechem.com/,Vadodara,Fine & performance chemicals,"Pharma excipients, AR/LR/GMP grade fine chemicals, intermediates",< ₹100 Cr,Kalpesh Patel,Promotional Director,Rich hands-on experience in chemicals manufacturing & product knowledge.,Strong,"Operates FDA-GMP certified dedicated plant at Manjusar, Vadodara for high-purity chemicals production.",Strong,HQ Vadodara,Moderate,Broad portfolio (350+ products) with FDA-GMP facility focused on pharma & food grade chemicals.,Moderate,Strong industry technical experience in manufacturing & product development.,Strong,Pharma excipients & fine chemicals supported by PLI & export demand.,Moderate,Modernizing by establishing a brand-new FDA-GMP manufacturing facility equipped with cutting-edge technology and an in-house R&D and GLP-certified laboratory,67.5,B — Probable Federer,Solid GMP manufacturing but only moderate differentiation and technical depth.,Operates an FDA-GMP certified plant producing over 350 fine chemicals and pharma excipients.
Prakash Chemicals International Pvt. Ltd. (PCIPL),https://www.prakashchemicals.com/,Vadodara,Specialty & performance chemicals,"Fine chemicals, custom manufacturing (MAX series), performance intermediates",~₹400-500 Cr+,Manish Shah,Managing Director,MBA (Gold Medalist) in Finance & International Business.,Strong,"In-house manufacturing, blending & R&D center at Gorwa, Vadodara + Dahej SEZ facilities.",Strong,HQ Vadodara,Moderate,Strong custom synthesis & application support with exports to 100+ countries.,Moderate,Gen-2 leader with formal business education & deep industry experience.,Strong,Specialty chemicals exports with global network & Make-in-India push.,Moderate,"Expansions in warehousing/R&D, strong export market additions.",67.5,B — Probable Federer,Good scale and exports but moderate technical DM and differentiation.,Built a strong global network with custom manufacturing and exports to 100+ countries.
